[{"active_canonical_facility_count":1,"adjudication_status":"candidate_rejected_first_entry","census_region":"Midwest","county_fips":"26125","county_first_entry_adjudication_id":"fea_26125_edgeconnex_det01_20150311_rejected","county_name":"Oakland County","created_at":"2026-09-01T18:41:01Z","dated_operational_candidate_count":1,"first_entry_research_candidate_id":"fer_036da98560f3d088fafa","initial_tranche_rank":5,"inventory_completeness_status":"not_established","named_source_record_count":1,"national_rank":5,"panel_complete_year_count":24,"priority_score":87.5,"priority_tier":"first_entry_high","queue_status":"initial_tranche","record_status":"provisional","region_rank":2,"required_findings":["earliest_dated_operational_event","exact_facility_identity_for_earliest_event","county_inventory_completeness","documented_search_for_earlier_operations"],"research_objective":"verify_county_first_operational_entry","research_status":"evidence_collected","research_summary":"Earlier operation documented; dated anchor rejected. County first entry remains unresolved pending a complete historical inventory.","reviewed_operational_facility_count":1,"schema_version":"1.0.0","score_components":{"dated_event_anchor":100.0,"inventory_audit_feasibility":100.0,"panel_completeness":100.0,"reviewed_operational_evidence":50.0,"source_identity_coverage":100.0},"selection_reasons":["complete_24_year_panel","governed_dated_operational_candidate","reviewed_current_operational_evidence","manageable_inventory_audit_scope","strong_source_identity_coverage"],"source_record_count":1,"state_abbr":"MI","suggested_source_types":["local_government_record","permit_record","planning_record","assessor_record","utility_filing","regulatory_filing","operator_release","sec_filing","local_news"],"treatment_definition_id":"trt_first_entry_v1","updated_at":"2026-09-01T18:41:01Z"},{"active_canonical_facility_count":1,"census_region":"Midwest","county_fips":"26099","county_name":"Macomb County","created_at":"2026-09-01T18:41:01Z","dated_operational_candidate_count":0,"first_entry_research_candidate_id":"fer_da904872ea5fbac9d6ab","named_source_record_count":1,"national_rank":52,"panel_complete_year_count":24,"priority_score":45.0,"priority_tier":"first_entry_standard","queue_status":"national_backlog","record_status":"provisional","region_rank":12,"required_findings":["earliest_dated_operational_event","exact_facility_identity_for_earliest_event","county_inventory_completeness","documented_search_for_earlier_operations"],"research_objective":"verify_county_first_operational_entry","research_status":"queued","reviewed_operational_facility_count":0,"schema_version":"1.0.0","score_components":{"dated_event_anchor":0.0,"inventory_audit_feasibility":100.0,"panel_completeness":100.0,"reviewed_operational_evidence":0.0,"source_identity_coverage":100.0},"selection_reasons":["complete_24_year_panel","manageable_inventory_audit_scope","strong_source_identity_coverage"],"source_record_count":1,"state_abbr":"MI","suggested_source_types":["local_government_record","permit_record","planning_record","assessor_record","utility_filing","regulatory_filing","operator_release","sec_filing","local_news"],"treatment_definition_id":"trt_first_entry_v1","updated_at":"2026-09-01T18:41:01Z"},{"active_canonical_facility_count":2,"census_region":"Midwest","county_fips":"26045","county_name":"Eaton County","created_at":"2026-09-01T18:41:01Z","dated_operational_candidate_count":0,"first_entry_research_candidate_id":"fer_9ac3637dc5d222ea7242","named_source_record_count":2,"national_rank":103,"panel_complete_year_count":24,"priority_score":42.36,"priority_tier":"first_entry_deferred","queue_status":"national_backlog","record_status":"provisional","region_rank":30,"required_findings":["earliest_dated_operational_event","exact_facility_identity_for_earliest_event","county_inventory_completeness","documented_search_for_earlier_operations"],"research_objective":"verify_county_first_operational_entry","research_status":"queued","reviewed_operational_facility_count":0,"schema_version":"1.0.0","score_components":{"dated_event_anchor":0.0,"inventory_audit_feasibility":86.82,"panel_completeness":100.0,"reviewed_operational_evidence":0.0,"source_identity_coverage":100.0},"selection_reasons":["complete_24_year_panel","manageable_inventory_audit_scope","strong_source_identity_coverage"],"source_record_count":2,"state_abbr":"MI","suggested_source_types":["local_government_record","permit_record","planning_record","assessor_record","utility_filing","regulatory_filing","operator_release","sec_filing","local_news"],"treatment_definition_id":"trt_first_entry_v1","updated_at":"2026-09-01T18:41:01Z"},{"active_canonical_facility_count":1,"census_region":"Midwest","county_fips":"26049","county_name":"Genesee County","created_at":"2026-09-01T18:41:01Z","dated_operational_candidate_count":0,"first_entry_research_candidate_id":"fer_78125429d3a7abb924ba","named_source_record_count":0,"national_rank":173,"panel_complete_year_count":24,"priority_score":35.0,"priority_tier":"first_entry_deferred","queue_status":"national_backlog","record_status":"provisional","region_rank":47,"required_findings":["earliest_dated_operational_event","exact_facility_identity_for_earliest_event","county_inventory_completeness","documented_search_for_earlier_operations"],"research_objective":"verify_county_first_operational_entry","research_status":"queued","reviewed_operational_facility_count":0,"schema_version":"1.0.0","score_components":{"dated_event_anchor":0.0,"inventory_audit_feasibility":100.0,"panel_completeness":100.0,"reviewed_operational_evidence":0.0,"source_identity_coverage":0.0},"selection_reasons":["complete_24_year_panel","manageable_inventory_audit_scope"],"source_record_count":1,"state_abbr":"MI","suggested_source_types":["local_government_record","permit_record","planning_record","assessor_record","utility_filing","regulatory_filing","operator_release","sec_filing","local_news"],"treatment_definition_id":"trt_first_entry_v1","updated_at":"2026-09-01T18:41:01Z"},{"active_canonical_facility_count":1,"census_region":"Midwest","county_fips":"26115","county_name":"Monroe County","created_at":"2026-09-01T18:41:01Z","dated_operational_candidate_count":0,"first_entry_research_candidate_id":"fer_1c34ae139d858b7da1b7","named_source_record_count":0,"national_rank":174,"panel_complete_year_count":24,"priority_score":35.0,"priority_tier":"first_entry_deferred","queue_status":"national_backlog","record_status":"provisional","region_rank":48,"required_findings":["earliest_dated_operational_event","exact_facility_identity_for_earliest_event","county_inventory_completeness","documented_search_for_earlier_operations"],"research_objective":"verify_county_first_operational_entry","research_status":"queued","reviewed_operational_facility_count":0,"schema_version":"1.0.0","score_components":{"dated_event_anchor":0.0,"inventory_audit_feasibility":100.0,"panel_completeness":100.0,"reviewed_operational_evidence":0.0,"source_identity_coverage":0.0},"selection_reasons":["complete_24_year_panel","manageable_inventory_audit_scope"],"source_record_count":1,"state_abbr":"MI","suggested_source_types":["local_government_record","permit_record","planning_record","assessor_record","utility_filing","regulatory_filing","operator_release","sec_filing","local_news"],"treatment_definition_id":"trt_first_entry_v1","updated_at":"2026-09-01T18:41:01Z"},{"active_canonical_facility_count":4,"census_region":"Midwest","county_fips":"26163","county_name":"Wayne County","created_at":"2026-09-01T18:41:01Z","dated_operational_candidate_count":0,"first_entry_research_candidate_id":"fer_4cd0c884c321db265f42","named_source_record_count":1,"national_rank":205,"panel_complete_year_count":24,"priority_score":32.23,"priority_tier":"first_entry_deferred","queue_status":"national_backlog","record_status":"provisional","region_rank":59,"required_findings":["earliest_dated_operational_event","exact_facility_identity_for_earliest_event","county_inventory_completeness","documented_search_for_earlier_operations"],"research_objective":"verify_county_first_operational_entry","research_status":"queued","reviewed_operational_facility_count":0,"schema_version":"1.0.0","score_components":{"dated_event_anchor":0.0,"inventory_audit_feasibility":73.63,"panel_completeness":100.0,"reviewed_operational_evidence":0.0,"source_identity_coverage":25.0},"selection_reasons":["complete_24_year_panel","manageable_inventory_audit_scope"],"source_record_count":4,"state_abbr":"MI","suggested_source_types":["local_government_record","permit_record","planning_record","assessor_record","utility_filing","regulatory_filing","operator_release","sec_filing","local_news"],"treatment_definition_id":"trt_first_entry_v1","updated_at":"2026-09-01T18:41:01Z"}]
