[{"active_canonical_facility_count":1,"adjudication_status":"candidate_rejected_first_entry","census_region":"Midwest","county_fips":"18105","county_first_entry_adjudication_id":"fea_18105_iu_data_center_20091105_rejected","county_name":"Monroe County","created_at":"2026-09-02T04:05:01Z","dated_operational_candidate_count":1,"first_entry_research_candidate_id":"fer_bdd2954f6fc126a08beb","initial_tranche_rank":4,"inventory_completeness_status":"not_established","named_source_record_count":1,"national_rank":4,"panel_complete_year_count":24,"priority_score":87.5,"priority_tier":"first_entry_high","queue_status":"initial_tranche","record_status":"provisional","region_rank":1,"required_findings":["earliest_dated_operational_event","exact_facility_identity_for_earliest_event","county_inventory_completeness","documented_search_for_earlier_operations"],"research_objective":"verify_county_first_operational_entry","research_status":"evidence_collected","research_summary":"Earlier operation documented; dated anchor rejected. County first entry remains unresolved pending a complete historical inventory.","reviewed_operational_facility_count":1,"schema_version":"1.0.0","score_components":{"dated_event_anchor":100.0,"inventory_audit_feasibility":100.0,"panel_completeness":100.0,"reviewed_operational_evidence":50.0,"source_identity_coverage":100.0},"selection_reasons":["complete_24_year_panel","governed_dated_operational_candidate","reviewed_current_operational_evidence","manageable_inventory_audit_scope","strong_source_identity_coverage"],"source_record_count":1,"state_abbr":"IN","suggested_source_types":["local_government_record","permit_record","planning_record","assessor_record","utility_filing","regulatory_filing","operator_release","sec_filing","local_news"],"treatment_definition_id":"trt_first_entry_v1","updated_at":"2026-09-02T04:05:01Z"},{"active_canonical_facility_count":1,"adjudication_status":"unresolved","census_region":"Midwest","county_fips":"18089","county_first_entry_adjudication_id":"fea_18089_digital_crossroad_20201031_unresolved","county_name":"Lake County","created_at":"2026-09-02T04:05:01Z","dated_operational_candidate_count":1,"first_entry_research_candidate_id":"fer_558656bd35767b4975a6","initial_tranche_rank":24,"inventory_completeness_status":"not_established","named_source_record_count":1,"national_rank":38,"panel_complete_year_count":24,"priority_score":75.0,"priority_tier":"first_entry_high","queue_status":"initial_tranche","record_status":"provisional","region_rank":7,"required_findings":["earliest_dated_operational_event","exact_facility_identity_for_earliest_event","county_inventory_completeness","documented_search_for_earlier_operations"],"research_objective":"verify_county_first_operational_entry","research_status":"evidence_collected","research_summary":"A dated exact-facility operation is documented, but the county's first entry remains unresolved. Research must complete the historical inventory and search for earlier operations.","reviewed_operational_facility_count":0,"schema_version":"1.0.0","score_components":{"dated_event_anchor":100.0,"inventory_audit_feasibility":100.0,"panel_completeness":100.0,"reviewed_operational_evidence":0.0,"source_identity_coverage":100.0},"selection_reasons":["complete_24_year_panel","governed_dated_operational_candidate","manageable_inventory_audit_scope","strong_source_identity_coverage"],"source_record_count":1,"state_abbr":"IN","suggested_source_types":["local_government_record","permit_record","planning_record","assessor_record","utility_filing","regulatory_filing","operator_release","sec_filing","local_news"],"treatment_definition_id":"trt_first_entry_v1","updated_at":"2026-09-02T04:05:01Z"},{"active_canonical_facility_count":2,"census_region":"Midwest","county_fips":"18157","county_name":"Tippecanoe County","created_at":"2026-09-02T04:05:01Z","dated_operational_candidate_count":0,"first_entry_research_candidate_id":"fer_b4eec6f14e147b2c5d3d","named_source_record_count":2,"national_rank":100,"panel_complete_year_count":24,"priority_score":42.36,"priority_tier":"first_entry_deferred","queue_status":"national_backlog","record_status":"provisional","region_rank":29,"required_findings":["earliest_dated_operational_event","exact_facility_identity_for_earliest_event","county_inventory_completeness","documented_search_for_earlier_operations"],"research_objective":"verify_county_first_operational_entry","research_status":"queued","reviewed_operational_facility_count":0,"schema_version":"1.0.0","score_components":{"dated_event_anchor":0.0,"inventory_audit_feasibility":86.82,"panel_completeness":100.0,"reviewed_operational_evidence":0.0,"source_identity_coverage":100.0},"selection_reasons":["complete_24_year_panel","manageable_inventory_audit_scope","strong_source_identity_coverage"],"source_record_count":2,"state_abbr":"IN","suggested_source_types":["local_government_record","permit_record","planning_record","assessor_record","utility_filing","regulatory_filing","operator_release","sec_filing","local_news"],"treatment_definition_id":"trt_first_entry_v1","updated_at":"2026-09-02T04:05:01Z"},{"active_canonical_facility_count":1,"census_region":"Midwest","county_fips":"18059","county_name":"Hancock County","created_at":"2026-09-02T04:05:01Z","dated_operational_candidate_count":0,"first_entry_research_candidate_id":"fer_7f79bfd63118d4875ee3","named_source_record_count":0,"national_rank":169,"panel_complete_year_count":24,"priority_score":35.0,"priority_tier":"first_entry_deferred","queue_status":"national_backlog","record_status":"provisional","region_rank":46,"required_findings":["earliest_dated_operational_event","exact_facility_identity_for_earliest_event","county_inventory_completeness","documented_search_for_earlier_operations"],"research_objective":"verify_county_first_operational_entry","research_status":"queued","reviewed_operational_facility_count":0,"schema_version":"1.0.0","score_components":{"dated_event_anchor":0.0,"inventory_audit_feasibility":100.0,"panel_completeness":100.0,"reviewed_operational_evidence":0.0,"source_identity_coverage":0.0},"selection_reasons":["complete_24_year_panel","manageable_inventory_audit_scope"],"source_record_count":1,"state_abbr":"IN","suggested_source_types":["local_government_record","permit_record","planning_record","assessor_record","utility_filing","regulatory_filing","operator_release","sec_filing","local_news"],"treatment_definition_id":"trt_first_entry_v1","updated_at":"2026-09-02T04:05:01Z"}]
