[{"active_canonical_facility_count":1,"census_region":"South","county_fips":"40013","county_name":"Bryan County","created_at":"2026-09-01T18:57:58Z","dated_operational_candidate_count":0,"first_entry_research_candidate_id":"fer_d383bf375e696b615b0d","named_source_record_count":1,"national_rank":76,"panel_complete_year_count":24,"priority_score":45.0,"priority_tier":"first_entry_standard","queue_status":"national_backlog","record_status":"provisional","region_rank":19,"required_findings":["earliest_dated_operational_event","exact_facility_identity_for_earliest_event","county_inventory_completeness","documented_search_for_earlier_operations"],"research_objective":"verify_county_first_operational_entry","research_status":"queued","reviewed_operational_facility_count":0,"schema_version":"1.0.0","score_components":{"dated_event_anchor":0.0,"inventory_audit_feasibility":100.0,"panel_completeness":100.0,"reviewed_operational_evidence":0.0,"source_identity_coverage":100.0},"selection_reasons":["complete_24_year_panel","manageable_inventory_audit_scope","strong_source_identity_coverage"],"source_record_count":1,"state_abbr":"OK","suggested_source_types":["local_government_record","permit_record","planning_record","assessor_record","utility_filing","regulatory_filing","operator_release","sec_filing","local_news"],"treatment_definition_id":"trt_first_entry_v1","updated_at":"2026-09-01T18:57:58Z"},{"active_canonical_facility_count":1,"census_region":"South","county_fips":"40109","county_name":"Oklahoma County","created_at":"2026-09-01T18:57:58Z","dated_operational_candidate_count":0,"first_entry_research_candidate_id":"fer_63054db50896cc8b2fae","named_source_record_count":1,"national_rank":77,"panel_complete_year_count":24,"priority_score":45.0,"priority_tier":"first_entry_standard","queue_status":"national_backlog","record_status":"provisional","region_rank":20,"required_findings":["earliest_dated_operational_event","exact_facility_identity_for_earliest_event","county_inventory_completeness","documented_search_for_earlier_operations"],"research_objective":"verify_county_first_operational_entry","research_status":"queued","reviewed_operational_facility_count":0,"schema_version":"1.0.0","score_components":{"dated_event_anchor":0.0,"inventory_audit_feasibility":100.0,"panel_completeness":100.0,"reviewed_operational_evidence":0.0,"source_identity_coverage":100.0},"selection_reasons":["complete_24_year_panel","manageable_inventory_audit_scope","strong_source_identity_coverage"],"source_record_count":1,"state_abbr":"OK","suggested_source_types":["local_government_record","permit_record","planning_record","assessor_record","utility_filing","regulatory_filing","operator_release","sec_filing","local_news"],"treatment_definition_id":"trt_first_entry_v1","updated_at":"2026-09-01T18:57:58Z"},{"active_canonical_facility_count":3,"census_region":"South","county_fips":"40143","county_name":"Tulsa County","created_at":"2026-09-01T18:57:58Z","dated_operational_candidate_count":0,"first_entry_research_candidate_id":"fer_cd26c9b96bb8085d2036","named_source_record_count":2,"national_rank":147,"panel_complete_year_count":24,"priority_score":37.49,"priority_tier":"first_entry_deferred","queue_status":"national_backlog","record_status":"provisional","region_rank":48,"required_findings":["earliest_dated_operational_event","exact_facility_identity_for_earliest_event","county_inventory_completeness","documented_search_for_earlier_operations"],"research_objective":"verify_county_first_operational_entry","research_status":"queued","reviewed_operational_facility_count":0,"schema_version":"1.0.0","score_components":{"dated_event_anchor":0.0,"inventory_audit_feasibility":79.1,"panel_completeness":100.0,"reviewed_operational_evidence":0.0,"source_identity_coverage":66.67},"selection_reasons":["complete_24_year_panel","manageable_inventory_audit_scope"],"source_record_count":3,"state_abbr":"OK","suggested_source_types":["local_government_record","permit_record","planning_record","assessor_record","utility_filing","regulatory_filing","operator_release","sec_filing","local_news"],"treatment_definition_id":"trt_first_entry_v1","updated_at":"2026-09-01T18:57:58Z"},{"active_canonical_facility_count":1,"census_region":"South","county_fips":"40101","county_name":"Muskogee County","created_at":"2026-09-01T18:57:58Z","dated_operational_candidate_count":0,"first_entry_research_candidate_id":"fer_8a42c161ae3a72372584","named_source_record_count":0,"national_rank":182,"panel_complete_year_count":24,"priority_score":35.0,"priority_tier":"first_entry_deferred","queue_status":"national_backlog","record_status":"provisional","region_rank":57,"required_findings":["earliest_dated_operational_event","exact_facility_identity_for_earliest_event","county_inventory_completeness","documented_search_for_earlier_operations"],"research_objective":"verify_county_first_operational_entry","research_status":"queued","reviewed_operational_facility_count":0,"schema_version":"1.0.0","score_components":{"dated_event_anchor":0.0,"inventory_audit_feasibility":100.0,"panel_completeness":100.0,"reviewed_operational_evidence":0.0,"source_identity_coverage":0.0},"selection_reasons":["complete_24_year_panel","manageable_inventory_audit_scope"],"source_record_count":1,"state_abbr":"OK","suggested_source_types":["local_government_record","permit_record","planning_record","assessor_record","utility_filing","regulatory_filing","operator_release","sec_filing","local_news"],"treatment_definition_id":"trt_first_entry_v1","updated_at":"2026-09-01T18:57:58Z"}]
