[{"active_canonical_facility_count":2,"census_region":"Northeast","county_fips":"33015","county_name":"Rockingham County","created_at":"2026-09-01T16:52:35Z","dated_operational_candidate_count":0,"first_entry_research_candidate_id":"fer_049cb7b9c430a0f5a422","initial_tranche_rank":16,"named_source_record_count":1,"national_rank":16,"panel_complete_year_count":24,"priority_score":49.86,"priority_tier":"first_entry_standard","queue_status":"initial_tranche","record_status":"provisional","region_rank":5,"required_findings":["earliest_dated_operational_event","exact_facility_identity_for_earliest_event","county_inventory_completeness","documented_search_for_earlier_operations"],"research_objective":"verify_county_first_operational_entry","research_status":"queued","reviewed_operational_facility_count":1,"schema_version":"1.0.0","score_components":{"dated_event_anchor":0.0,"inventory_audit_feasibility":86.82,"panel_completeness":100.0,"reviewed_operational_evidence":50.0,"source_identity_coverage":50.0},"selection_reasons":["complete_24_year_panel","reviewed_current_operational_evidence","manageable_inventory_audit_scope"],"source_record_count":2,"state_abbr":"NH","suggested_source_types":["local_government_record","permit_record","planning_record","assessor_record","utility_filing","regulatory_filing","operator_release","sec_filing","local_news"],"treatment_definition_id":"trt_first_entry_v1","updated_at":"2026-09-01T16:52:35Z"},{"active_canonical_facility_count":1,"census_region":"Northeast","county_fips":"33017","county_name":"Strafford County","created_at":"2026-09-01T16:52:35Z","dated_operational_candidate_count":0,"first_entry_research_candidate_id":"fer_b9c1ed49d63580d09647","named_source_record_count":0,"national_rank":176,"panel_complete_year_count":24,"priority_score":35.0,"priority_tier":"first_entry_deferred","queue_status":"national_backlog","record_status":"provisional","region_rank":25,"required_findings":["earliest_dated_operational_event","exact_facility_identity_for_earliest_event","county_inventory_completeness","documented_search_for_earlier_operations"],"research_objective":"verify_county_first_operational_entry","research_status":"queued","reviewed_operational_facility_count":0,"schema_version":"1.0.0","score_components":{"dated_event_anchor":0.0,"inventory_audit_feasibility":100.0,"panel_completeness":100.0,"reviewed_operational_evidence":0.0,"source_identity_coverage":0.0},"selection_reasons":["complete_24_year_panel","manageable_inventory_audit_scope"],"source_record_count":1,"state_abbr":"NH","suggested_source_types":["local_government_record","permit_record","planning_record","assessor_record","utility_filing","regulatory_filing","operator_release","sec_filing","local_news"],"treatment_definition_id":"trt_first_entry_v1","updated_at":"2026-09-01T16:52:35Z"}]
