[{"active_canonical_facility_count":1,"census_region":"West","county_fips":"30017","county_name":"Custer County","created_at":"2026-09-01T14:41:26Z","dated_operational_candidate_count":0,"first_entry_research_candidate_id":"fer_15624cebe66ba2228517","named_source_record_count":1,"national_rank":61,"panel_complete_year_count":24,"priority_score":45.0,"priority_tier":"first_entry_standard","queue_status":"national_backlog","record_status":"provisional","region_rank":17,"required_findings":["earliest_dated_operational_event","exact_facility_identity_for_earliest_event","county_inventory_completeness","documented_search_for_earlier_operations"],"research_objective":"verify_county_first_operational_entry","research_status":"queued","reviewed_operational_facility_count":0,"schema_version":"1.0.0","score_components":{"dated_event_anchor":0.0,"inventory_audit_feasibility":100.0,"panel_completeness":100.0,"reviewed_operational_evidence":0.0,"source_identity_coverage":100.0},"selection_reasons":["complete_24_year_panel","manageable_inventory_audit_scope","strong_source_identity_coverage"],"source_record_count":1,"state_abbr":"MT","suggested_source_types":["local_government_record","permit_record","planning_record","assessor_record","utility_filing","regulatory_filing","operator_release","sec_filing","local_news"],"treatment_definition_id":"trt_first_entry_v1","updated_at":"2026-09-01T14:41:26Z"},{"active_canonical_facility_count":1,"census_region":"West","county_fips":"30039","county_name":"Granite County","created_at":"2026-09-01T14:41:26Z","dated_operational_candidate_count":0,"first_entry_research_candidate_id":"fer_4ae5c663850b5d2e9f87","named_source_record_count":0,"national_rank":175,"panel_complete_year_count":24,"priority_score":35.0,"priority_tier":"first_entry_deferred","queue_status":"national_backlog","record_status":"provisional","region_rank":47,"required_findings":["earliest_dated_operational_event","exact_facility_identity_for_earliest_event","county_inventory_completeness","documented_search_for_earlier_operations"],"research_objective":"verify_county_first_operational_entry","research_status":"queued","reviewed_operational_facility_count":0,"schema_version":"1.0.0","score_components":{"dated_event_anchor":0.0,"inventory_audit_feasibility":100.0,"panel_completeness":100.0,"reviewed_operational_evidence":0.0,"source_identity_coverage":0.0},"selection_reasons":["complete_24_year_panel","manageable_inventory_audit_scope"],"source_record_count":1,"state_abbr":"MT","suggested_source_types":["local_government_record","permit_record","planning_record","assessor_record","utility_filing","regulatory_filing","operator_release","sec_filing","local_news"],"treatment_definition_id":"trt_first_entry_v1","updated_at":"2026-09-01T14:41:26Z"}]
