[{"active_canonical_facility_count":1,"census_region":"South","county_fips":"28033","county_name":"DeSoto County","created_at":"2026-09-01T17:12:05Z","dated_operational_candidate_count":0,"first_entry_research_candidate_id":"fer_e232a806f668fc656370","named_source_record_count":1,"national_rank":58,"panel_complete_year_count":24,"priority_score":45.0,"priority_tier":"first_entry_standard","queue_status":"national_backlog","record_status":"provisional","region_rank":18,"required_findings":["earliest_dated_operational_event","exact_facility_identity_for_earliest_event","county_inventory_completeness","documented_search_for_earlier_operations"],"research_objective":"verify_county_first_operational_entry","research_status":"queued","reviewed_operational_facility_count":0,"schema_version":"1.0.0","score_components":{"dated_event_anchor":0.0,"inventory_audit_feasibility":100.0,"panel_completeness":100.0,"reviewed_operational_evidence":0.0,"source_identity_coverage":100.0},"selection_reasons":["complete_24_year_panel","manageable_inventory_audit_scope","strong_source_identity_coverage"],"source_record_count":1,"state_abbr":"MS","suggested_source_types":["local_government_record","permit_record","planning_record","assessor_record","utility_filing","regulatory_filing","operator_release","sec_filing","local_news"],"treatment_definition_id":"trt_first_entry_v1","updated_at":"2026-09-01T17:12:05Z"}]
