[{"active_canonical_facility_count":1,"adjudication_status":"candidate_rejected_first_entry","census_region":"South","county_fips":"05119","county_first_entry_adjudication_id":"fea_05119_tierpoint_20120412_rejected","county_name":"Pulaski County","created_at":"2026-09-02T04:58:42Z","dated_operational_candidate_count":1,"first_entry_research_candidate_id":"fer_8ea6ca962119fb8c79fa","inventory_completeness_status":"not_established","named_source_record_count":1,"national_rank":28,"panel_complete_year_count":24,"priority_score":75.0,"priority_tier":"first_entry_high","queue_status":"national_backlog","record_status":"provisional","region_rank":9,"required_findings":["earliest_dated_operational_event","exact_facility_identity_for_earliest_event","county_inventory_completeness","documented_search_for_earlier_operations"],"research_objective":"verify_county_first_operational_entry","research_status":"evidence_collected","research_summary":"Earlier operation documented; dated anchor rejected. County first entry remains unresolved pending a complete historical inventory.","reviewed_operational_facility_count":0,"schema_version":"1.0.0","score_components":{"dated_event_anchor":100.0,"inventory_audit_feasibility":100.0,"panel_completeness":100.0,"reviewed_operational_evidence":0.0,"source_identity_coverage":100.0},"selection_reasons":["complete_24_year_panel","governed_dated_operational_candidate","manageable_inventory_audit_scope","strong_source_identity_coverage"],"source_record_count":1,"state_abbr":"AR","suggested_source_types":["local_government_record","permit_record","planning_record","assessor_record","utility_filing","regulatory_filing","operator_release","sec_filing","local_news"],"treatment_definition_id":"trt_first_entry_v1","updated_at":"2026-09-02T04:58:42Z"},{"active_canonical_facility_count":1,"adjudication_status":"unresolved","census_region":"South","county_fips":"05145","county_first_entry_adjudication_id":"fea_05145_searcy_20260901_unresolved","county_name":"White County","created_at":"2026-09-02T04:58:42Z","dated_operational_candidate_count":1,"first_entry_research_candidate_id":"fer_d3e565988471f8c8d15f","inventory_completeness_status":"not_established","named_source_record_count":1,"national_rank":29,"panel_complete_year_count":24,"priority_score":75.0,"priority_tier":"first_entry_high","queue_status":"national_backlog","record_status":"provisional","region_rank":10,"required_findings":["earliest_dated_operational_event","exact_facility_identity_for_earliest_event","county_inventory_completeness","documented_search_for_earlier_operations"],"research_objective":"verify_county_first_operational_entry","research_status":"evidence_collected","research_summary":"A dated exact-facility operation is documented, but the county's first entry remains unresolved. Research must complete the historical inventory and search for earlier operations.","reviewed_operational_facility_count":0,"schema_version":"1.0.0","score_components":{"dated_event_anchor":100.0,"inventory_audit_feasibility":100.0,"panel_completeness":100.0,"reviewed_operational_evidence":0.0,"source_identity_coverage":100.0},"selection_reasons":["complete_24_year_panel","governed_dated_operational_candidate","manageable_inventory_audit_scope","strong_source_identity_coverage"],"source_record_count":1,"state_abbr":"AR","suggested_source_types":["local_government_record","permit_record","planning_record","assessor_record","utility_filing","regulatory_filing","operator_release","sec_filing","local_news"],"treatment_definition_id":"trt_first_entry_v1","updated_at":"2026-09-02T04:58:42Z"}]
