[{"active_canonical_facility_count":1,"census_region":"West","county_fips":"16007","county_name":"Bear Lake County","created_at":"2026-09-02T06:05:35Z","dated_operational_candidate_count":0,"first_entry_research_candidate_id":"fer_e2d4f7ab8050dff40a8c","named_source_record_count":1,"national_rank":75,"panel_complete_year_count":24,"priority_score":45.0,"priority_tier":"first_entry_standard","queue_status":"national_backlog","record_status":"provisional","region_rank":21,"required_findings":["earliest_dated_operational_event","exact_facility_identity_for_earliest_event","county_inventory_completeness","documented_search_for_earlier_operations"],"research_objective":"verify_county_first_operational_entry","research_status":"evidence_collected","research_summary":"The county's only mapped seed was adjudicated as a non-data-center false positive. County first entry remains unresolved pending a corrected historical facility inventory.","reviewed_operational_facility_count":0,"schema_version":"1.0.0","score_components":{"dated_event_anchor":0.0,"inventory_audit_feasibility":100.0,"panel_completeness":100.0,"reviewed_operational_evidence":0.0,"source_identity_coverage":100.0},"selection_reasons":["complete_24_year_panel","manageable_inventory_audit_scope","strong_source_identity_coverage"],"source_record_count":1,"state_abbr":"ID","suggested_source_types":["local_government_record","permit_record","planning_record","assessor_record","utility_filing","regulatory_filing","operator_release","sec_filing","local_news"],"treatment_definition_id":"trt_first_entry_v1","updated_at":"2026-09-02T06:05:35Z"},{"active_canonical_facility_count":1,"census_region":"West","county_fips":"16065","county_name":"Madison County","created_at":"2026-09-02T06:05:35Z","dated_operational_candidate_count":0,"first_entry_research_candidate_id":"fer_6977ebecbf06a0aaf7a4","named_source_record_count":1,"national_rank":76,"panel_complete_year_count":24,"priority_score":45.0,"priority_tier":"first_entry_standard","queue_status":"national_backlog","record_status":"provisional","region_rank":22,"required_findings":["earliest_dated_operational_event","exact_facility_identity_for_earliest_event","county_inventory_completeness","documented_search_for_earlier_operations"],"research_objective":"verify_county_first_operational_entry","research_status":"evidence_collected","research_summary":"The county's only mapped seed was adjudicated as a non-data-center false positive. County first entry remains unresolved pending a corrected historical facility inventory.","reviewed_operational_facility_count":0,"schema_version":"1.0.0","score_components":{"dated_event_anchor":0.0,"inventory_audit_feasibility":100.0,"panel_completeness":100.0,"reviewed_operational_evidence":0.0,"source_identity_coverage":100.0},"selection_reasons":["complete_24_year_panel","manageable_inventory_audit_scope","strong_source_identity_coverage"],"source_record_count":1,"state_abbr":"ID","suggested_source_types":["local_government_record","permit_record","planning_record","assessor_record","utility_filing","regulatory_filing","operator_release","sec_filing","local_news"],"treatment_definition_id":"trt_first_entry_v1","updated_at":"2026-09-02T06:05:35Z"},{"active_canonical_facility_count":2,"census_region":"West","county_fips":"16001","county_name":"Ada County","created_at":"2026-09-02T06:05:35Z","dated_operational_candidate_count":0,"first_entry_research_candidate_id":"fer_68ec339c4126b6a593bf","named_source_record_count":1,"national_rank":161,"panel_complete_year_count":24,"priority_score":35.7,"priority_tier":"first_entry_deferred","queue_status":"national_backlog","record_status":"provisional","region_rank":43,"required_findings":["earliest_dated_operational_event","exact_facility_identity_for_earliest_event","county_inventory_completeness","documented_search_for_earlier_operations"],"research_objective":"verify_county_first_operational_entry","research_status":"queued","reviewed_operational_facility_count":0,"schema_version":"1.0.0","score_components":{"dated_event_anchor":0.0,"inventory_audit_feasibility":86.82,"panel_completeness":100.0,"reviewed_operational_evidence":0.0,"source_identity_coverage":33.33},"selection_reasons":["complete_24_year_panel","manageable_inventory_audit_scope"],"source_record_count":3,"state_abbr":"ID","suggested_source_types":["local_government_record","permit_record","planning_record","assessor_record","utility_filing","regulatory_filing","operator_release","sec_filing","local_news"],"treatment_definition_id":"trt_first_entry_v1","updated_at":"2026-09-02T06:05:35Z"}]
