[{"active_canonical_facility_count":1,"adjudication_status":"unresolved","census_region":"South","county_fips":"21071","county_first_entry_adjudication_id":"fea_21071_ekn_20230501_unresolved","county_name":"Floyd County","created_at":"2026-09-02T13:37:42Z","dated_operational_candidate_count":1,"first_entry_research_candidate_id":"fer_09b69c5d2b3da8560cd8","inventory_completeness_status":"not_established","named_source_record_count":1,"national_rank":39,"panel_complete_year_count":24,"priority_score":75.0,"priority_tier":"first_entry_high","queue_status":"national_backlog","record_status":"provisional","region_rank":13,"required_findings":["earliest_dated_operational_event","exact_facility_identity_for_earliest_event","county_inventory_completeness","documented_search_for_earlier_operations"],"research_objective":"verify_county_first_operational_entry","research_status":"evidence_collected","research_summary":"A dated exact-facility operation is documented, but the county's first entry remains unresolved. Research must complete the historical inventory and search for earlier operations.","reviewed_operational_facility_count":0,"schema_version":"1.0.0","score_components":{"dated_event_anchor":100.0,"inventory_audit_feasibility":100.0,"panel_completeness":100.0,"reviewed_operational_evidence":0.0,"source_identity_coverage":100.0},"selection_reasons":["complete_24_year_panel","governed_dated_operational_candidate","manageable_inventory_audit_scope","strong_source_identity_coverage"],"source_record_count":1,"state_abbr":"KY","suggested_source_types":["local_government_record","permit_record","planning_record","assessor_record","utility_filing","regulatory_filing","operator_release","sec_filing","local_news"],"treatment_definition_id":"trt_first_entry_v1","updated_at":"2026-09-02T13:37:42Z"},{"active_canonical_facility_count":2,"adjudication_status":"unresolved","census_region":"South","county_fips":"21111","county_first_entry_adjudication_id":"fea_21111_flexential_louisville_east_20170109_unresolved","county_name":"Jefferson County","created_at":"2026-09-02T13:37:42Z","dated_operational_candidate_count":1,"first_entry_research_candidate_id":"fer_307bcf413c0c421dec26","inventory_completeness_status":"not_established","named_source_record_count":2,"national_rank":75,"panel_complete_year_count":24,"priority_score":72.36,"priority_tier":"first_entry_high","queue_status":"national_backlog","record_status":"provisional","region_rank":27,"required_findings":["earliest_dated_operational_event","exact_facility_identity_for_earliest_event","county_inventory_completeness","documented_search_for_earlier_operations"],"research_objective":"verify_county_first_operational_entry","research_status":"evidence_collected","research_summary":"A dated exact-facility operation is documented, but the county's first entry remains unresolved. Research must complete the historical inventory and search for earlier operations.","reviewed_operational_facility_count":0,"schema_version":"1.0.0","score_components":{"dated_event_anchor":100.0,"inventory_audit_feasibility":86.82,"panel_completeness":100.0,"reviewed_operational_evidence":0.0,"source_identity_coverage":100.0},"selection_reasons":["complete_24_year_panel","governed_dated_operational_candidate","manageable_inventory_audit_scope","strong_source_identity_coverage"],"source_record_count":2,"state_abbr":"KY","suggested_source_types":["local_government_record","permit_record","planning_record","assessor_record","utility_filing","regulatory_filing","operator_release","sec_filing","local_news"],"treatment_definition_id":"trt_first_entry_v1","updated_at":"2026-09-02T13:37:42Z"}]
