[{"active_canonical_facility_count":20,"census_region":"West","county_fips":"32003","county_name":"Clark County","created_at":"2026-09-01T15:47:29Z","dated_operational_candidate_count":0,"first_entry_research_candidate_id":"fer_2d4e08ed8a6b0ef19bb5","initial_tranche_rank":5,"named_source_record_count":22,"national_rank":5,"panel_complete_year_count":24,"priority_score":58.17,"priority_tier":"first_entry_standard","queue_status":"initial_tranche","record_status":"provisional","region_rank":3,"required_findings":["earliest_dated_operational_event","exact_facility_identity_for_earliest_event","county_inventory_completeness","documented_search_for_earlier_operations"],"research_objective":"verify_county_first_operational_entry","research_status":"queued","reviewed_operational_facility_count":2,"schema_version":"1.0.0","score_components":{"dated_event_anchor":0.0,"inventory_audit_feasibility":43.02,"panel_completeness":100.0,"reviewed_operational_evidence":100.0,"source_identity_coverage":95.65},"selection_reasons":["complete_24_year_panel","reviewed_current_operational_evidence","strong_source_identity_coverage"],"source_record_count":23,"state_abbr":"NV","suggested_source_types":["local_government_record","permit_record","planning_record","assessor_record","utility_filing","regulatory_filing","operator_release","sec_filing","local_news"],"treatment_definition_id":"trt_first_entry_v1","updated_at":"2026-09-01T15:47:29Z"},{"active_canonical_facility_count":4,"census_region":"West","county_fips":"32029","county_name":"Storey County","created_at":"2026-09-01T15:47:29Z","dated_operational_candidate_count":0,"first_entry_research_candidate_id":"fer_f54994f2e13dff8a710c","named_source_record_count":1,"national_rank":206,"panel_complete_year_count":24,"priority_score":32.23,"priority_tier":"first_entry_deferred","queue_status":"national_backlog","record_status":"provisional","region_rank":54,"required_findings":["earliest_dated_operational_event","exact_facility_identity_for_earliest_event","county_inventory_completeness","documented_search_for_earlier_operations"],"research_objective":"verify_county_first_operational_entry","research_status":"queued","reviewed_operational_facility_count":0,"schema_version":"1.0.0","score_components":{"dated_event_anchor":0.0,"inventory_audit_feasibility":73.63,"panel_completeness":100.0,"reviewed_operational_evidence":0.0,"source_identity_coverage":25.0},"selection_reasons":["complete_24_year_panel","manageable_inventory_audit_scope"],"source_record_count":4,"state_abbr":"NV","suggested_source_types":["local_government_record","permit_record","planning_record","assessor_record","utility_filing","regulatory_filing","operator_release","sec_filing","local_news"],"treatment_definition_id":"trt_first_entry_v1","updated_at":"2026-09-01T15:47:29Z"},{"active_canonical_facility_count":11,"census_region":"West","county_fips":"32031","county_name":"Washoe County","created_at":"2026-09-01T15:47:29Z","dated_operational_candidate_count":0,"first_entry_research_candidate_id":"fer_5063c5245fe79ebba2b3","named_source_record_count":0,"national_rank":217,"panel_complete_year_count":24,"priority_score":25.88,"priority_tier":"first_entry_deferred","queue_status":"national_backlog","record_status":"provisional","region_rank":58,"required_findings":["earliest_dated_operational_event","exact_facility_identity_for_earliest_event","county_inventory_completeness","documented_search_for_earlier_operations"],"research_objective":"verify_county_first_operational_entry","research_status":"queued","reviewed_operational_facility_count":0,"schema_version":"1.0.0","score_components":{"dated_event_anchor":0.0,"inventory_audit_feasibility":54.39,"panel_completeness":100.0,"reviewed_operational_evidence":0.0,"source_identity_coverage":0.0},"selection_reasons":["complete_24_year_panel"],"source_record_count":11,"state_abbr":"NV","suggested_source_types":["local_government_record","permit_record","planning_record","assessor_record","utility_filing","regulatory_filing","operator_release","sec_filing","local_news"],"treatment_definition_id":"trt_first_entry_v1","updated_at":"2026-09-01T15:47:29Z"}]
