[{"active_canonical_facility_count":1,"adjudication_status":"candidate_rejected_first_entry","census_region":"Midwest","county_fips":"29019","county_first_entry_adjudication_id":"fea_29019_carfax_2004_rejected","county_name":"Boone County","created_at":"2026-09-02T17:00:01Z","dated_operational_candidate_count":1,"first_entry_research_candidate_id":"fer_c227743ebc2048853c33","inventory_completeness_status":"not_established","named_source_record_count":1,"national_rank":47,"panel_complete_year_count":24,"priority_score":75.0,"priority_tier":"first_entry_high","queue_status":"national_backlog","record_status":"provisional","region_rank":12,"required_findings":["earliest_dated_operational_event","exact_facility_identity_for_earliest_event","county_inventory_completeness","documented_search_for_earlier_operations"],"research_objective":"verify_county_first_operational_entry","research_status":"evidence_collected","research_summary":"Earlier operation documented; dated anchor rejected. County first entry remains unresolved pending a complete historical inventory.","reviewed_operational_facility_count":0,"schema_version":"1.0.0","score_components":{"dated_event_anchor":100.0,"inventory_audit_feasibility":100.0,"panel_completeness":100.0,"reviewed_operational_evidence":0.0,"source_identity_coverage":100.0},"selection_reasons":["complete_24_year_panel","governed_dated_operational_candidate","manageable_inventory_audit_scope","strong_source_identity_coverage"],"source_record_count":1,"state_abbr":"MO","suggested_source_types":["local_government_record","permit_record","planning_record","assessor_record","utility_filing","regulatory_filing","operator_release","sec_filing","local_news"],"treatment_definition_id":"trt_first_entry_v1","updated_at":"2026-09-02T17:00:01Z"},{"active_canonical_facility_count":3,"adjudication_status":"unresolved","census_region":"Midwest","county_fips":"29510","county_first_entry_adjudication_id":"fea_29510_wustl_genome_20250917_unresolved","county_name":"St. Louis city","created_at":"2026-09-02T17:00:01Z","dated_operational_candidate_count":1,"first_entry_research_candidate_id":"fer_ac8417f1a27f9cadcff8","inventory_completeness_status":"not_established","named_source_record_count":3,"national_rank":93,"panel_complete_year_count":24,"priority_score":70.82,"priority_tier":"first_entry_high","queue_status":"national_backlog","record_status":"provisional","region_rank":22,"required_findings":["earliest_dated_operational_event","exact_facility_identity_for_earliest_event","county_inventory_completeness","documented_search_for_earlier_operations"],"research_objective":"verify_county_first_operational_entry","research_status":"evidence_collected","research_summary":"A dated exact-facility operation is documented, but the county's first entry remains unresolved. Research must complete the historical inventory and search for earlier operations.","reviewed_operational_facility_count":0,"schema_version":"1.0.0","score_components":{"dated_event_anchor":100.0,"inventory_audit_feasibility":79.1,"panel_completeness":100.0,"reviewed_operational_evidence":0.0,"source_identity_coverage":100.0},"selection_reasons":["complete_24_year_panel","governed_dated_operational_candidate","manageable_inventory_audit_scope","strong_source_identity_coverage"],"source_record_count":3,"state_abbr":"MO","suggested_source_types":["local_government_record","permit_record","planning_record","assessor_record","utility_filing","regulatory_filing","operator_release","sec_filing","local_news"],"treatment_definition_id":"trt_first_entry_v1","updated_at":"2026-09-02T17:00:01Z"},{"active_canonical_facility_count":2,"adjudication_status":"unresolved","census_region":"Midwest","county_fips":"29047","county_first_entry_adjudication_id":"fea_29047_meta_kansas_city_20250820_unresolved","county_name":"Clay County","created_at":"2026-09-02T17:00:01Z","dated_operational_candidate_count":1,"first_entry_research_candidate_id":"fer_d36def8ac9d98b1cfeaa","inventory_completeness_status":"not_established","named_source_record_count":2,"national_rank":107,"panel_complete_year_count":24,"priority_score":69.03,"priority_tier":"first_entry_high","queue_status":"national_backlog","record_status":"provisional","region_rank":25,"required_findings":["earliest_dated_operational_event","exact_facility_identity_for_earliest_event","county_inventory_completeness","documented_search_for_earlier_operations"],"research_objective":"verify_county_first_operational_entry","research_status":"evidence_collected","research_summary":"A dated exact-facility operation is documented, but the county's first entry remains unresolved. Research must complete the historical inventory and search for earlier operations.","reviewed_operational_facility_count":0,"schema_version":"1.0.0","score_components":{"dated_event_anchor":100.0,"inventory_audit_feasibility":86.82,"panel_completeness":100.0,"reviewed_operational_evidence":0.0,"source_identity_coverage":66.67},"selection_reasons":["complete_24_year_panel","governed_dated_operational_candidate","manageable_inventory_audit_scope"],"source_record_count":3,"state_abbr":"MO","suggested_source_types":["local_government_record","permit_record","planning_record","assessor_record","utility_filing","regulatory_filing","operator_release","sec_filing","local_news"],"treatment_definition_id":"trt_first_entry_v1","updated_at":"2026-09-02T17:00:01Z"},{"active_canonical_facility_count":1,"census_region":"Midwest","county_fips":"29025","county_name":"Caldwell County","created_at":"2026-09-02T17:00:01Z","dated_operational_candidate_count":0,"first_entry_research_candidate_id":"fer_7e48e2e50a2fb0802f3c","named_source_record_count":1,"national_rank":121,"panel_complete_year_count":24,"priority_score":45.0,"priority_tier":"first_entry_standard","queue_status":"national_backlog","record_status":"provisional","region_rank":32,"required_findings":["earliest_dated_operational_event","exact_facility_identity_for_earliest_event","county_inventory_completeness","documented_search_for_earlier_operations"],"research_objective":"verify_county_first_operational_entry","research_status":"evidence_collected","research_summary":"The reviewed mapped seed was adjudicated as a non-data-center false positive. County first entry remains unresolved pending a corrected historical facility inventory.","reviewed_operational_facility_count":0,"schema_version":"1.0.0","score_components":{"dated_event_anchor":0.0,"inventory_audit_feasibility":100.0,"panel_completeness":100.0,"reviewed_operational_evidence":0.0,"source_identity_coverage":100.0},"selection_reasons":["complete_24_year_panel","manageable_inventory_audit_scope","strong_source_identity_coverage"],"source_record_count":1,"state_abbr":"MO","suggested_source_types":["local_government_record","permit_record","planning_record","assessor_record","utility_filing","regulatory_filing","operator_release","sec_filing","local_news"],"treatment_definition_id":"trt_first_entry_v1","updated_at":"2026-09-02T17:00:01Z"},{"active_canonical_facility_count":2,"census_region":"Midwest","county_fips":"29095","county_name":"Jackson County","created_at":"2026-09-02T17:00:01Z","dated_operational_candidate_count":0,"first_entry_research_candidate_id":"fer_31d6164ec4b5f72236c7","named_source_record_count":1,"national_rank":150,"panel_complete_year_count":24,"priority_score":37.36,"priority_tier":"first_entry_deferred","queue_status":"national_backlog","record_status":"provisional","region_rank":39,"required_findings":["earliest_dated_operational_event","exact_facility_identity_for_earliest_event","county_inventory_completeness","documented_search_for_earlier_operations"],"research_objective":"verify_county_first_operational_entry","research_status":"queued","reviewed_operational_facility_count":0,"schema_version":"1.0.0","score_components":{"dated_event_anchor":0.0,"inventory_audit_feasibility":86.82,"panel_completeness":100.0,"reviewed_operational_evidence":0.0,"source_identity_coverage":50.0},"selection_reasons":["complete_24_year_panel","manageable_inventory_audit_scope"],"source_record_count":2,"state_abbr":"MO","suggested_source_types":["local_government_record","permit_record","planning_record","assessor_record","utility_filing","regulatory_filing","operator_release","sec_filing","local_news"],"treatment_definition_id":"trt_first_entry_v1","updated_at":"2026-09-02T17:00:01Z"},{"active_canonical_facility_count":5,"census_region":"Midwest","county_fips":"29165","county_name":"Platte County","created_at":"2026-09-02T17:00:01Z","dated_operational_candidate_count":0,"first_entry_research_candidate_id":"fer_341d7ae3055579559819","named_source_record_count":2,"national_rank":207,"panel_complete_year_count":24,"priority_score":32.21,"priority_tier":"first_entry_deferred","queue_status":"national_backlog","record_status":"provisional","region_rank":60,"required_findings":["earliest_dated_operational_event","exact_facility_identity_for_earliest_event","county_inventory_completeness","documented_search_for_earlier_operations"],"research_objective":"verify_county_first_operational_entry","research_status":"queued","reviewed_operational_facility_count":0,"schema_version":"1.0.0","score_components":{"dated_event_anchor":0.0,"inventory_audit_feasibility":69.39,"panel_completeness":100.0,"reviewed_operational_evidence":0.0,"source_identity_coverage":33.33},"selection_reasons":["complete_24_year_panel","manageable_inventory_audit_scope"],"source_record_count":6,"state_abbr":"MO","suggested_source_types":["local_government_record","permit_record","planning_record","assessor_record","utility_filing","regulatory_filing","operator_release","sec_filing","local_news"],"treatment_definition_id":"trt_first_entry_v1","updated_at":"2026-09-02T17:00:01Z"}]
