[{"active_canonical_facility_count":2,"adjudication_status":"candidate_rejected_first_entry","census_region":"Northeast","county_fips":"25017","county_first_entry_adjudication_id":"fea_25017_markley_lowell_20151123_rejected","county_name":"Middlesex County","created_at":"2026-09-02T04:58:42Z","dated_operational_candidate_count":1,"first_entry_research_candidate_id":"fer_bde7533aacb49a720f30","initial_tranche_rank":9,"inventory_completeness_status":"not_established","named_source_record_count":2,"national_rank":9,"panel_complete_year_count":24,"priority_score":84.86,"priority_tier":"first_entry_high","queue_status":"initial_tranche","record_status":"provisional","region_rank":3,"required_findings":["earliest_dated_operational_event","exact_facility_identity_for_earliest_event","county_inventory_completeness","documented_search_for_earlier_operations"],"research_objective":"verify_county_first_operational_entry","research_status":"evidence_collected","research_summary":"Earlier operation documented; dated anchor rejected. County first entry remains unresolved pending a complete historical inventory.","reviewed_operational_facility_count":1,"schema_version":"1.0.0","score_components":{"dated_event_anchor":100.0,"inventory_audit_feasibility":86.82,"panel_completeness":100.0,"reviewed_operational_evidence":50.0,"source_identity_coverage":100.0},"selection_reasons":["complete_24_year_panel","governed_dated_operational_candidate","reviewed_current_operational_evidence","manageable_inventory_audit_scope","strong_source_identity_coverage"],"source_record_count":2,"state_abbr":"MA","suggested_source_types":["local_government_record","permit_record","planning_record","assessor_record","utility_filing","regulatory_filing","operator_release","sec_filing","local_news"],"treatment_definition_id":"trt_first_entry_v1","updated_at":"2026-09-02T04:58:42Z"},{"active_canonical_facility_count":1,"census_region":"Northeast","county_fips":"25009","county_name":"Essex County","created_at":"2026-09-02T04:58:42Z","dated_operational_candidate_count":0,"first_entry_research_candidate_id":"fer_d878ab1c8c26be460bd7","named_source_record_count":0,"national_rank":172,"panel_complete_year_count":24,"priority_score":35.0,"priority_tier":"first_entry_deferred","queue_status":"national_backlog","record_status":"provisional","region_rank":24,"required_findings":["earliest_dated_operational_event","exact_facility_identity_for_earliest_event","county_inventory_completeness","documented_search_for_earlier_operations"],"research_objective":"verify_county_first_operational_entry","research_status":"queued","reviewed_operational_facility_count":0,"schema_version":"1.0.0","score_components":{"dated_event_anchor":0.0,"inventory_audit_feasibility":100.0,"panel_completeness":100.0,"reviewed_operational_evidence":0.0,"source_identity_coverage":0.0},"selection_reasons":["complete_24_year_panel","manageable_inventory_audit_scope"],"source_record_count":1,"state_abbr":"MA","suggested_source_types":["local_government_record","permit_record","planning_record","assessor_record","utility_filing","regulatory_filing","operator_release","sec_filing","local_news"],"treatment_definition_id":"trt_first_entry_v1","updated_at":"2026-09-02T04:58:42Z"}]
